X,Y,OBJECTID,DATEREPORTED,INFORELIABILITY,INCIDENTREGION,DEAD,MISSING,NATIONALITIES,ORIGINREGION,MIGRANTROUTE,LOCATIONDESCRIPTION,NOFEMALE,NOMALE,NOCHILDREN,AGERANGE,SOURCE,URL,COMMENT,PUBLICVIEW,Cause_of_death,Number_of_survivors,type_location
16.4472,48.1813,467,2015-08-27T00:00:00.000Z,Partially Verified,Europe,71,,"Syrian, Iraqi, Afghan",MENA,Western Balkan,"A4 motorway, Vienna, Austria",8,59,4,,WSJ,http://www.4-traders.com/news/Austrian-Police-Identify-Migrant-Truck-Victims--21083074/,"Follow-up 23 September: Austrian police said they have managed to identify some of the 71 decomposing bodies found in a truck on one of the main migration routes from eastern to western Europe in late August. The nine men and one woman of Iraqi origin, all under the age of 50, have been successfully identified, and their relatives have been informed, local police said Wednesday. The bodies of the 59 men, eight women and four children found in a refrigeration truck Aug. 27 were so badly decomposed that none could be identified through photographs or visual inspection, police said. They now hope to be able to identify several others with the help of other methods, including dental records, DNA samples from family members, and precise fingerprints. http://www.4-traders.com/news/Austrian-Police-Identify-Migrant-Truck-Victims--21083074/ ",Yes,Suffocation,,
17.5891,35.1379,468,2015-08-25T00:00:00.000Z,Partially Verified,Mediterranean,1,,Somalia,Horn of Africa,Central Mediterranean,,,1,,,IOM Rome,http://www.iom.int/news/iom-continues-monitor-mediterranean-migrant-arrivals-and-deaths,,Yes,Unknown,,
26.5551,39.2411,469,2015-08-24T00:00:00.000Z,Verified,Mediterranean,2,4,Iraq,MENA,Eastern Mediterranean,"Off the coast of Lesvos, Greece",,6,,,IOM Greece,http://www.iom.int/news/iom-continues-monitor-mediterranean-migrant-arrivals-and-deaths,"IOM Greece is reporting the deaths of three Iraqi nationals, 30, 23, and 18-19 years of age. Two more 18-19 year old Iraqi nationals remain missing along with the smuggler, a Turkish national. Eight others, also Iraqi nationals, were rescued by the Hellenic Coast Guard. ",Yes,Drowning,,
26.47,39.3665,470,2015-08-21T00:00:00.000Z,Verified,Mediterranean,1,,Syria,MENA,Eastern Mediterranean,"Off the coast of Lesvos, Greece",,1,,30,IOM Greece,http://missingmigrants.iom.int/node/3550,"The man died following a shipwreck off the coast of Lesvos, Greece. The 19 survivors spent hours in the water before being rescued by the Hellenic Coast Guard.",Yes,Unknown (body recovered from boat),,
1.142580625000051,47.5172,471,2015-07-24T00:00:00.000Z,Partially Verified,Europe,1,,Unknown,Unknown,From Calais to the UK,,,1,,,The Express,http://bit.ly/1HXOSXN,,Yes,Unknown (found dead on top of train),,
-0.351563,49.838,472,2015-07-24T00:00:00.000Z,Partially Verified,Europe,1,,Unknown,Unknown,From Calais to the UK,,,1,,,The Independent,http://ind.pn/1Irgvhr,,Yes,Drowning,,
15.3369,34.6694,474,2015-01-18T00:00:00.000Z,Partially Verified,Mediterranean,1,,Unknown. Survivors all from Sub-Saharan African nations.,Sub-Saharan Africa,Central Mediterranean ,"Unspecified location between North Africa and Italy. Body brought to Reggio Calabria, Italy.",,,,,MediaSet TGCOM24,http://bit.ly/1sURQdS,,Yes,Unknown,,
27.4013,36.8236,475,2015-08-18T00:00:00.000Z,Partially Verified,Mediterranean,6,,Syrian. An infant was among the dead.,Middle East/ South Asia,Eastern Mediterranean,"Near the island of Kos, Greece",,,,,Associated Press,http://abcn.ws/1HU98II,"The incident occurred as a group of Syrians was travelling the short distance from the coast of Turkey to the Greek island of Kos. Two men and a child survived for hours by breathing air trapped underneath the overturned hull of the boat, before being rescued.  About 20 survivors were taken to the town of Turgutreis. It is not yet clear which boat they had been on, as other rescues also occurred on the same day. ",Yes,Drowning,,
,,476,2015-08-18T00:00:00.000Z,Verified,U.S./Mexico Border,3,,,Central America,,Pima County,,3,,,Pima County Office of the Medical Examiner,,,Yes,,,
35.1617,35.8267,477,2015-08-17T00:00:00.000Z,Partially Verified,Mediterranean,9,,Pakistan,South Asia,Eastern Mediterranean,Turkish waters,,,,,Press Association,http://bit.ly/1hrnRpN,"A boat of about 40 Palestinians departed from the Lebanese port of Tripoli and capsized after entering Turkish waters. At least 9 are believed to have died, including women and children. It is reported that the Palestinians were from the Yarmouk refugee camp in Damascus. ",Yes,Drowning,,
16.842011328000069,37.518410969000058,479,2015-08-16T00:00:00.000Z,Partially Verified,Mediterranean,1,,Somalia,Horn of Africa,Central Mediterranean ,Off the coast of Calabria,1,,,,Reuters,http://www.sharenet.co.za/news/One_boat_migrant_found_dead_in_Mediterranean_354_rescued/10ccaf5dd8469f52b9bb4a938ae48c84,"The woman's body was found during a rescue operation in rough waters off the coast of Calabria; another 354 migrants were saved. The rescue operation was carried out by two Italian coast guard ships, a Croatian coast guard vessel deployed under the Triton mission and a merchant ship. Nationality has not been verified. The deceased woman is believed to be from Somalia.",Yes,Unknown (body recovered from boat),,
11.4258,36.4566,483,2015-07-10T00:00:00.000Z,Verified,Mediterranean,30,,Syria,MENA,Central Mediterranean,,,,,,IOM Rome,http://missingmigrants.iom.int/node/938,,Yes,Presumed drowning,,
14.864514453000027,34.912936903000059,484,2015-07-09T00:00:00.000Z,Verified,Mediterranean,12,,Unknown,Unknown,Central Mediterranean,Off the coast of Libya (40 nautical miles north),,,,,IOM Rome,http://www.reuters.com/article/2015/07/09/europe-migrants-drown-idUSL8N0ZP4CY20150709,,Yes,"Drowning, Trampling",,
13.3264,34.4722,486,2015-08-10T22:00:00.000Z,Partially Verified,Mediterranean,,60,,Sub-Saharan Africa,Central Mediterranean,Channel of Sicily,18,42,,,IOM Rome,http://missingmigrants.iom.int/node/2102,,Yes,Drowning,54,
15.0073,34.2708,492,2015-08-15T00:00:00.000Z,Partially Verified,Mediterranean,49,,Mixed,Sub-Saharan Africa,Central Mediterranean,About 34 kilometers off the coast of Libya,,,,,IOM Rome,http://www.iom.int/news/mediterranean-migrants-died-poisonous-fumes-iom,"49 migrants were found dead on a ship carrying hundreds of people rescued by the Italian Navy vessel ""Cigala Fulgosi"" 21 miles off Libya's coast. The bodies of the 49 migrants were discovered by Italian navy officers in the hold of the ship, partially immersed in water and fuel. It is likely the migrants died of asphyxiation due to the fumes coming from the engine. According to early reports, the ""Cigala Fulgosi"" responded to a distress call and reached the 15-meter-long fishing trawler carrying the migrants, which left Zwara in the night between Friday and Saturday. By the end of operations 313 migrants were rescued, mainly from Morocco, Bangladesh, Pakistan, Sub-Sahara Africa and Syria. Nationalities of the deceased are still being verified. The bodies and survivors were transferred at high sea to the Norwegian vessel ""Siem Pilot"", which is patrolling the Mediterranean in the framework of the Triton operation.It is unclear if there are still migrants unaccounted for.",Yes,Presumed asphyxiation,313,
27.8903,39.6533,493,2015-08-08T00:00:00.000Z,Partially Verified,Middle East ,10,,Syria,MENA,Eastern Mediterranean,"Turkish province of Balikesir, resumably en route to coastal town of Ayvalik",3,7,,,Hurriyet Daily News,http://bit.ly/1Uym0NV,,Yes,Vehicle accident,,
12.7661,34.289,494,2015-08-06T00:00:00.000Z,Partially Verified,Mediterranean,25,202,Syria,MENA,Central Mediterranean,About 26 kilometers off the coast of Libya. Departed from Zuwara.,2,,3,,IOM Rome,http://bit.ly/1TdIZAp,"The number of missing is still undetermined, and will be updated as soon as more information becomes available. 25 bodies were recovered and survivorsÂ´ reports suggest between 200 and 250 may be missing, all presumed dead. ",Yes,Drowning,,
13.667,35.1199,496,2015-08-03T00:00:00.000Z,Partially Verified,Mediterranean,5,,Unknown,Unknown,Central Mediterranean,Unspecified location in the Central Mediterranean,,,,,IOM Rome,http://missingmigrants.iom.int/node/1574,,Yes,Unknown,,
-2.62573,36.1734,498,2015-08-03T00:00:00.000Z,Partially Verified,Mediterranean,1,,Moroccan,MENA,Western Mediterranean,On board a boat from Melilla to the mainland city of Almeria,,1,,,BBC,http://bbc.in/1KOMRAy,Man suffocated while being smuggled to Spain in a suitcase ,Yes,Suffocation,,
-5.32547,35.9272,499,2015-08-02T00:00:00.000Z,Verified,Mediterranean,4,,Nigeria (2) Cameroon (2),Sub-Saharan Africa,Western Mediterranean,Near Ceuta,,4,,,AFP,http://yhoo.it/1M2JMOU,,Yes,Drowning,,
1.85869,50.9513,504,2015-07-28T00:00:00.000Z,Partially Verified,Europe,1,,Pakistani,South Asia,From Calais to the UK,Eurotunnel,,1,,,Liberation Society,http://bit.ly/1Iq1pTj,,Yes,Road accident,,
2.10938,49.3824,506,2015-07-28T22:00:00.000Z,Partially Verified,Europe,1,,Sudan,Sub-Saharan Africa,From Calais to the UK,,,1,,,Guardian,http://bit.ly/1glqwRa,,Yes,Hit by vehicle,,
15.8203,35.7465,507,2015-07-27T00:00:00.000Z,Partially Verified,Mediterranean,14,,Mixed,South Asia,Central Mediterranean,Unspecified location in the Central Mediterranean,,9,,18-26,IOM Rome,http://missingmigrants.iom.int/node/1081,,Yes,Unknown,,
14.7437,34.2345,508,2015-07-23T00:00:00.000Z,Partially Verified,Mediterranean,,40,"Somalia, Eritrea, Benin, Mali",Sub-Saharan Africa,Central Mediterranean,Off the coast of Libya,,,,,Press TV,http://www.presstv.ir/Detail/2015/07/23/421569/migrants-dead-Libya-coast-Mediterranean-Europe,,Yes,Drowning,,
1.85869,50.9513,509,2015-07-19T00:00:00.000Z,Verified,Europe,1,,Eritrean,Horn of Africa,From Calais to the UK,Eurotunnel,,1,,,Calais Migrant Solidarity,http://bit.ly/1DPsGT2 and http://bit.ly/1N6V2IJ,,Yes,Drowning,,
,,510,2015-07-16T00:00:00.000Z,Partially verified,Mediterranean,6,,Syria,MENA,Central Mediterranean,Ã‡anakkale,,,,,Daily Sabah,http://www.dailysabah.com/nation/2015/07/16/six-dead-10-rescued-as-boat-carrying-syrian-asylum-seekers-sinks-off-turkeys-aegean-coast,,Yes,,,
1.85869,50.9513,511,2015-10-25T23:00:00.000Z,Verified,Europe,1,,Pakistani,South Asia,From Calais to the UK,Eurotunnel,,1,,,Calais Migrant Solidarity,http://bit.ly/1IVvIHS and http://bit.ly/1DPsGT2,,Yes,Struck by car,,
15.8203,35.1738,512,2015-07-15T00:00:00.000Z,Verified,Mediterranean,1,,Syria,MENA,Central Mediterranean,,1,,1,10,IOM Rome,http://www.wbal.com/article/117616/112/diabetic-girl-dies-on-migrant-boat-after-insulin-tossed-to-sea,,Yes,"Gylcemic crisis (Diabetic, medicine thrown overboard)",,
13.3818,32.8279,515,2015-07-14T22:00:00.000Z,Verified,Mediterranean,100,,Unknown,Unknown,Central Mediterranean,"Tajoura, 10 km east of Tripoli",,,,,UNHCR and Migrant Report,http://bit.ly/1SkzR7f,"At least 100 bodies believed to be migrants were found around Tajoura, Libya. Reports confirm that women and children are among the dead, but the more specific information remains unreported as of November 2015.",Yes,Drowning,,
1.47455,51.0179,516,2015-07-13T00:00:00.000Z,Partially Verified,Europe,1,,Sudanese,MENA,Channel Tunnel from France to the UK,Channel Tunnel (near entrance at Calais),,1,,,Calais Migrant Solidarity,https://calaismigrantsolidarity.wordpress.com/deaths-at-the-calais-border/,,Yes,Hit by vehicle,,
27.0371,37.3511,518,2015-07-07T00:00:00.000Z,Partially Verified,Mediterranean,3,15,Unknown,Unknown,Eastern Mediterranean,Between the Greek islands of Farmakonisi and Agathonisi,,,,,IOM Greece according to Greek government sources,http://bit.ly/1NRPfY7,Number on board boat estimated between 37 and 40,Yes,Drowning,,
1.80038,50.9143,519,2015-07-07T00:00:00.000Z,Partially Verified,Europe,1,,Eritrea,Horn of Africa,From Calais to the UK,"Channel Tunnel, French side",,1,,,The Guardian,http://bit.ly/1TnlRvV,,Yes,Fell from train,,
11.4066,33.2548,524,2015-07-06T00:00:00.000Z,Partially Verified,Mediterranean,9,,Unknown,Unknown,Central Mediterranean,Bodies found off the coast of Ben Guerdane,1,8,,,IOM Tunisia via Tunisian Coast Guard,http://missingmigrants.iom.int/node/926,Bodies found on July 6th and 9th in state of decomposition. Date(s) on which deaths occurred is undetermined. ,Yes,Presumed drowning,,
2.10938,49.6107,526,2015-06-29T00:00:00.000Z,Partially Verified,Europe,1,,Eritrea,Horn of Africa,From Calais to the UK,,1,,,,Calais Migrant Solidarity,http://bit.ly/1OOb8Ik,,Yes,Hit by vehicle,,
-92.8139,17.7212,529,2015-06-26T00:00:00.000Z,Partially Verified,Central America incl. Mexico,9,,Guatemala and El Salvador,Central America,,"Municipality of Jalapa. About 55 km south east of Villahermosa, Tabasco while crossing the San Marcos River",,,,,El Universo,http://bit.ly/1glFaYh,Not clear if this was a migration-related incident - i.e. if the status of migrant was a (indirect) causal factor in their death and if their death occurred while in transit to an international destination. ,Yes,Vehicle accident,,
1.78408,50.9223,530,2015-06-26T00:00:00.000Z,Partially Verified,Europe,1,,Eritrea,Horn of Africa,Channel Tunnel from France to the UK,"Channel Tunnel, French side near Calais terminal",,1,,,The Guardian,http://bit.ly/1KNxevI,,Yes,Fell from train,,
27.4196,37.0059,531,2015-06-23T00:00:00.000Z,Partially Verified,Mediterranean,6,,Syrian,MENA,Eastern Mediterranean,3.2 kilometers from Bodrum,,,,,Turkey Agenda,http://www.turkeyagenda.com/boat-carrying-migrants-sinks-in-aegean-sea-6-dead-2558.html,,Yes,Drowning,,
13.956460840000034,35.645955220000076,532,2015-06-23T00:00:00.000Z,Verified,Mediterranean,1,,Unknown,Unknown,Central Mediterranean ,Off the coast of Libya,,,,,IOM Rome,http://missingmigrants.iom.int/node/920,,Yes,Shot,,
15.4688,34.3071,536,2015-06-17T00:00:00.000Z,Verified,Mediterranean,3,,Gambia (2) Guinea  Bissau (1),Sub-Saharan Africa,Central Mediterranean,,,,,,IOM Rome,http://missingmigrants.iom.int/node/914,,Yes,Drowning,,
-110.331,29.2972,543,2015-06-02T00:00:00.000Z,Partially Verified,Central America incl. Mexico,3,,Unknown,Central America,Central America to United States,,,,,,Yahoo! News,https://news.yahoo.com/death-trap-mexico-must-probe-migrant-attacks-amnesty-234527485.html,,Yes,Violent robbery,,
1.40625,49.6107,545,2015-05-31T00:00:00.000Z,Partially Verified,Europe,1,,Eritrea,Horn of Africa,From Calais to the UK,A16 Highway at the entrance to the Eurotunnel.,,1,,,Calais Migrant Solidarity,http://bit.ly/1OOb8Ik,,Yes,Hit by vehicle,,
,,546,2015-05-30T00:00:00.000Z,Verified,Mediterranean,17,8,Ivory Coast (1) Unknown (16),,Central Mediterranean,,,,,,IOM Rome,http://missingmigrants.iom.int/node/914,,Yes,,,
89.487406250000049,13.498141042000043,549,2015-05-26T00:00:00.000Z,Verified,Southeast Asia,2,,"Bangladeshi, Rohingya",South East Asia,Bay of Bengal and Andaman Sea,Bay of Bengal,,,,,IOM SITREP,,,Yes,Unknown,,
-100.156984374999979,26.213257166000062,550,2015-05-26T00:00:00.000Z,Partially Verified,Central America incl. Mexico,1,,Unkown,Central America & Mexico,Central America to United States,"Ramos Arizpe, Mexico on the way to Laredo",,1,,,El Siglo,http://bit.ly/20rhPXZ,An approximately 30-year-old migrant fell to his death from the train that would take him to the US-Mexico border at Laredo.,Yes,Fell from train,,
30.322228125000038,31.914824693000071,551,2015-05-25T00:00:00.000Z,Partially Verified,Mediterranean,5,,African,Sub-Saharan Africa,Central Mediterranean ,"Off coast of Kafr el-Sheikh, Egypt",,,,,Le Figaro,http://bit.ly/1AqSSCy,,Yes,Drowning,,
11.4892,35.9492,552,2015-05-23T00:00:00.000Z,Partially Verified,Mediterranean,5,,Tunisia,MENA,Central Mediterranean ,Teboulba,,,,,Business Standard,"5 Italy-bound Tunisian migrants drown, 49 rescued in Med",,Yes,Drowning,,
14.0625,36.5979,554,2015-05-21T00:00:00.000Z,Partially Verified,Mediterranean,1,,Eritrea,Horn of Africa,Central Mediterranean,,,1,,,IOM Rome,http://missingmigrants.iom.int/node/902,,Yes,Inhalation of toxic fumes from boat engine,,
47.9846,-13.2081,555,2015-05-20T00:00:00.000Z,Partially Verified,Sub-Saharan Africa,8,,Malagasy,Sub-Saharan Africa,From Madagascar to Mayotte,Nosy Be (Northern Madagascar),5,3,,,LINFO,http://bit.ly/1g8tisr,,Yes,Drowning,,
97.931785156000046,4.718780353000056,556,2015-05-19T00:00:00.000Z,Verified,Southeast Asia,1,,Unknown,South Asia,From Bangladesh to Indonesia,"Indonesia, Cut Meutia Hospital",,1,,,IOM SITREP,,Died in hospital,Yes,Unknown,,
93.5101,19.7357,559,2015-05-12T00:00:00.000Z,Verified,Southeast Asia,47,,"Myanmar, Bangladesh",South Asia,Bay of Bengal and Andaman Sea,"Bodies found on beaches of Rakhine, Myanmar",,,,,Press TV,http://www.presstv.ir/Detail/2015/06/03/414204/Myanmar-migrants-Rohing,Reported to be Rohingya,Yes,Drowning,,
14.1119,36.5626,561,2015-05-04T00:00:00.000Z,Verified,Mediterranean,5,41,Mixed,Sub-Saharan Africa,Central Mediterranean ,"Unspecified location south of Sicily, Italy",,,,,IOM Rome,http://www.bbc.com/news/world-europe-32593187,,Yes,Mostly drowning,,
31.2891,31.6534,562,2015-05-02T00:00:00.000Z,Partially Verified,Mediterranean,3,,Unknown,Unknown,Central Mediterranean ,"off the coast of Beheira's Edku city, Egypt",,,,,Ahram Online,http://bit.ly/1brfBSA,,Yes,Drowning,31,
-1.592286655999942,35.908983109000076,564,2015-01-03T23:00:00.000Z,Partially Verified,Mediterranean,5,,Unknown,Unknown,Western Mediterranean,80 km north of Algeria,,,,,El Periodico,http://bit.ly/20GoXzL,,Yes,Drowning,,
13.178704047000053,32.581556135000028,565,2015-01-19T23:00:00.000Z,Partially Verified,North Africa,12,,Nigeria,Sub-Saharan Africa,Other,"between Tarhuna and Tripoli, Libya",,,,,FFM-Online,http://bit.ly/1MRM1Yh,,Yes,Vehicle accident,,
20.265556116000027,39.503885811000032,566,2015-04-20T22:00:00.000Z,Partially Verified,Mediterranean,1,,Afghan,South Asia,Central Mediterranean,"On ferry from Igoumenitsa, Greece to Bari, Italy",,1,,21,TheLocal.it,http://bit.ly/1XZhNnY,,Yes,Crushed by bus on ferry,,
27.28888838000006,36.893329966000067,568,2015-08-16T22:00:00.000Z,Partially Verified,Mediterranean,1,,Syria,Middle East,Eastern Mediterranean,"At the foot of a cliff on the coast of Kos, Greece",,1,,16,AFP,http://bit.ly/20J8bjv,e body of a 16-year-old Syrian boy smuggled from Turkey was found at the foot of a cliff on the Greek island of Kos. It was unclear for how long the boy had been dead.,Yes,Unknown,,
26.557274029000041,39.344441160000031,569,2015-08-24T10:27:00.000Z,Partially Verified,Mediterranean,3,,"Syria, Afghanistan",MENA,Eastern Mediterranean,Between Turkey and Lesvos,,,,,AP,http://bit.ly/1O13lr2,"The Turkish Coast Guard recovered 3 bodies and rescued 73 survivors after their boat capsized en route to Lesvos, Greece from Canakkale, Turkey.",Yes,Drowning,,
26.515184863000059,39.314606292000065,9763,2015-11-26T23:00:00.000Z,Partially Verified,Mediterranean,4,,Afghanistan,South Asia,Eastern Mediterranean,"Off the coast of Ayvacik, Turkey",,,4,,AP,http://bit.ly/1SnxT7o,,Yes,Drowning,50,
26.406945660000076,39.502976392000051,10163,2015-11-27T23:00:00.000Z,Partially Verified,Mediterranean,5,,Unknown,MENA,Eastern Mediterranean,"Bodies washed ashore Ayvacik district, Canakkale, Turkey",1,2,2,2 infants,Hurriyet Daily News,http://bit.ly/1NDccm0,,Yes,Drowning,,
26.246270611000057,38.406249019000029,10963,2015-11-30T23:00:00.000Z,Partially Verified,Mediterranean,3,30,Syria,MENA,Eastern Mediterranean,"Off the coast of Cesme, Izmir, Turkey. Heading for Chios",1,,6,20 days to 9y,Anadolu Agency,http://bit.ly/1HHteNj,"A boat carrying around 35 people heading for the Greek island of Chios sank off the coast of Cesme, Izmir province. 3 bodies were found washed up on a Turkish beach, while the 2 survivors reported at least 30 missing. One of the survivors, Ali Alsaho, lost his wife and 7 children in the accident",Yes,Drowning,,
-100.401622877999955,20.59164641600006,11364,2015-11-12T23:00:00.000Z,Partially Verified,Central America incl. Mexico,1,,El Salvador,Central America,Other,"Santiago de Querétaro, Querétaro, Mexico",,1,,,Diario de Querétaro,http://bit.ly/1OHQEBJ,"A migrant was killed in a hit-and-run in the capital city of Querétaro, Mexico. An acquaintance said that the migrant had arrived in Mexico to 'find his destiny' in the United States.",Yes,Hit by vehicle,,
29.49891038100003,36.159216493000031,11763,2015-11-30T23:00:00.000Z,Partially Verified,Mediterranean,1,,Unknown,MENA,Eastern Mediterranean,"off the coast of Ro, Greece",,1,1,3,AP,http://abcn.ws/1NrKdUh,,Yes,Drowning,24,
29.985528843000054,-22.218441494999979,11764,2015-12-03T23:00:00.000Z,Partially Verified,Sub-Saharan Africa,3,,Zimbabwe,Sub-Saharan Africa,Other,"Near the New Limpopo Bridge in Beitbridge, Zimbabwe, close to South African border",,3,1,7-9,Masasi News First,http://bit.ly/1NL9z1k,"Three Zimbabweans were killed by a hippopotamus near the New Limpopo Bridge in Beitbridge, Zimbabwe while attempting to illegally cross into South Africa. Among the deceased were two men and a child estimated to be aged between 7 and 9 years.",Yes,Killed by hippopotamus,,
27.022180035000076,37.471038600000043,13763,2015-12-08T23:00:00.000Z,Verified,Mediterranean,12,13,Unknown,Middle East/ South Asia,Eastern Mediterranean,"Off the coast of Farmakonisi, Greece",2,4,5,1 infant,IOM Greece,http://bit.ly/1Y2gkeK,"A boat capsized off the coast of Farmakonisi, Greece, killing 12 migrants, including 5 children. 8 more are still missing, while 26 were rescued.",Yes,Drowning,26,
21.771839036000074,40.93011060200007,12163,2015-12-02T23:00:00.000Z,Verified,Europe,1,,Moroccan,MENA,Other,Greek-Macedonian border,,1,,22,IOM Greece,http://wapo.st/1TyLOZo,A 22-year-old Moroccan migrant was killed after touching electrified cables on top of a train carriage on the Greek-Macedonian border. The death came amid scuffles between migrants and refugees following the Macedonian authorities' closure of the border to those considered economic migrants.,Yes,Electrocuted,,
27.107573942000045,37.276233234000074,12164,2015-12-02T23:00:00.000Z,Partially Verified,Mediterranean,3,2,Unknown,MENA,Eastern Mediterranean,"Off the coast of Farmakonissi, Greece",1,,,,,AP,,Yes,Drowning,,
1.818170025000029,50.939388674000043,12563,2015-12-02T23:00:00.000Z,Partially Verified,Europe,1,,Sudan,MENA,Calais to UK,Calais motorway,,1,1,teenager,Calais Migrant Solidarity,http://bit.ly/1DPsGT2,,Yes,Hit by vehicle,,
1.914050950000046,50.933407701000078,12564,2015-12-01T23:00:00.000Z,Partially Verified,Europe,1,,Ethiopia,Horn of Africa,Calais to UK,"Calais motorway, France",,1,,,Calais Migrant Solidarity,http://bit.ly/1DPsGT2,"A migrant from Ethiopia was struck and killed by a car on a motorway in Calais, France",Yes,Hit by vehicle,,
26.214435472000048,38.331956798000078,12565,2015-12-07T23:00:00.000Z,Partially Verified,Mediterranean,6,,Afghan,MENA,Eastern Mediterranean,"off the coast of Cesme, Izmir, Turkey near Chios, Greece",,,6,1 infant,Hurriyet Daily News,http://bit.ly/1XW83hJ,"Six Afghan children drowned after an inflatable migrant boat capsized off the coast of Cesme, Izmir, Turkey en route to Chios, Greece. 8 other migrants were rescued by the Turkish Coast Guard.",Yes,Drowning,8,
27.118060960000037,37.318839156000024,12566,2015-12-09T23:00:00.000Z,Partially Verified,Mediterranean,4,9,Iraq,MENA,Eastern Mediterranean,"near Farmakonisi, Greece",,,,,Hurriyet Daily News,http://bit.ly/1RcqvOT,"Four Iraqi refugees drowned, while nine remain missing after their boat capsized near Farmakonisi, Greece. Turkish Coast Guard rescued two refugees from the water, while five others managed to swim back to the Turkish mainland.",Yes,Drowning,7,
-15.27955256499996,26.544303107000076,12964,2015-12-07T23:00:00.000Z,Partially Verified,North Africa,11,27,Reported as unspecified nationals of Africa,Sub-Saharan Africa,Western Mediterranean,140km south of Boujdor in Western Sahara en route to Canary Islands,1,10,,,Reuters,"http://bit.ly/1NVoYwm; http://bit.ly/28IfW7F",Moroccan authorities recovered the bodies of 11 African migrants off the coast of Boujedor whose boat sank apparently due to bad weather as they tried to cross to the Canary Islands.,Yes,Drowning,,
28.572376146000067,-20.159103991999928,12965,2015-12-07T23:00:00.000Z,Partially Verified,Sub-Saharan Africa,2,,Ethiopia,Horn of Africa,Other,"highway in Bulawayo, Zimbabwe",,,,,Zegabi,http://www.zegabi.com/articles/9845,"A bus trafficking 21 Ethiopians illegally to South Africa crashed on a highway in Zimbabwe’s second largest city Bulawayo on Tuesday. Two people were killed and 19 others sustained serious injuries after the crash, which was triggered by a burst tire.",Yes,Vehicle accident,19,
27.133167161000074,37.305186130000038,12966,2015-12-08T23:00:00.000Z,Partially Verified,Mediterranean,1,,Unknown,Middle East/ South Asia,Eastern Mediterranean,"off the Aegean coast of Turkey en route to Farmakonisi, Greece",,,1,6 month old,Hurriyet Daily News,http://bit.ly/1Y2gkeK,"A six-month-old migrant baby was found dead off the Aegean coast after a migrant boat bound for Farmakonisi capsized on Dec. 8 at around 10 p.m. The Turkish coast guard reportedly rescued 18 migrants, including six children, after that capsizing.",Yes,Drowning,18,
27.311017977000063,36.882620185000064,12967,2015-12-08T23:00:00.000Z,Verified,Mediterranean,1,,Unknown,MENA,Eastern Mediterranean,"On the shore of Kos, Greece",,,,,IOM Greece,,The body of a migrant was found washed up on the Greek island of Kos.,Yes,Drowning,,
27.027423753000051,37.469403691000025,14163,2015-12-09T23:00:00.000Z,Partially Verified,Mediterranean,4,,Unknown,MENA,Eastern Mediterranean,"Off the coast of Farmakonisi, Greece",1,2,1,1 infant,AP,http://bit.ly/1OT8dRp,"4 bodies were found off the coast of Farmakonisi, Greece. 2 were adult men, 1 was an adult woman, while 1 body was that of an infant.",Yes,Drowning,,
